{
  "$schema": "http://json-schema.org/draft-07/schema#",
  "type": "object",
  "properties": {
    "$schema": {
      "type": "string"
    },
    "formatVersion": {
      "type": "number",
      "const": 1
    },
    "codegen": {
      "type": "object",
      "properties": {
        "commentLocale": {
          "type": "string",
          "enum": [
            "en",
            "ja"
          ]
        },
        "cpp": {
          "type": "object",
          "properties": {
            "className": {
              "type": "string"
            },
            "header": {
              "type": "string"
            },
            "source": {
              "type": "string"
            }
          },
          "additionalProperties": false
        },
        "python": {
          "type": "object",
          "properties": {
            "className": {
              "type": "string"
            },
            "file": {
              "type": "string"
            }
          },
          "additionalProperties": false
        }
      },
      "additionalProperties": false
    },
    "form": {
      "type": "object",
      "properties": {
        "name": {
          "type": "string"
        },
        "class": {
          "type": "string",
          "const": "TForm"
        },
        "properties": {
          "type": "object",
          "propertyNames": {
            "type": "string"
          },
          "additionalProperties": {
            "$ref": "#/definitions/__schema0"
          }
        },
        "events": {
          "type": "object",
          "propertyNames": {
            "type": "string"
          },
          "additionalProperties": {
            "type": "string"
          }
        },
        "controls": {
          "type": "array",
          "items": {
            "$ref": "#/definitions/__schema1"
          }
        }
      },
      "required": [
        "name",
        "class"
      ],
      "additionalProperties": false
    },
    "components": {
      "type": "array",
      "items": {
        "type": "object",
        "properties": {
          "name": {
            "type": "string"
          },
          "class": {
            "type": "string"
          },
          "design": {
            "type": "object",
            "properties": {
              "left": {
                "type": "integer",
                "minimum": -9007199254740991,
                "maximum": 9007199254740991
              },
              "top": {
                "type": "integer",
                "minimum": -9007199254740991,
                "maximum": 9007199254740991
              }
            },
            "required": [
              "left",
              "top"
            ],
            "additionalProperties": false
          },
          "properties": {
            "type": "object",
            "propertyNames": {
              "type": "string"
            },
            "additionalProperties": {
              "$ref": "#/definitions/__schema0"
            }
          },
          "events": {
            "type": "object",
            "propertyNames": {
              "type": "string"
            },
            "additionalProperties": {
              "type": "string"
            }
          },
          "items": {
            "type": "array",
            "items": {
              "$ref": "#/definitions/__schema2"
            }
          },
          "actions": {
            "type": "array",
            "items": {
              "type": "object",
              "properties": {
                "name": {
                  "type": "string"
                },
                "class": {
                  "type": "string"
                },
                "properties": {
                  "type": "object",
                  "propertyNames": {
                    "type": "string"
                  },
                  "additionalProperties": {
                    "$ref": "#/definitions/__schema0"
                  }
                },
                "events": {
                  "type": "object",
                  "propertyNames": {
                    "type": "string"
                  },
                  "additionalProperties": {
                    "type": "string"
                  }
                }
              },
              "required": [
                "name"
              ],
              "additionalProperties": false
            }
          }
        },
        "required": [
          "name",
          "class"
        ],
        "additionalProperties": false
      }
    }
  },
  "required": [
    "formatVersion",
    "form"
  ],
  "additionalProperties": false,
  "definitions": {
    "__schema0": {
      "anyOf": [
        {
          "type": "string"
        },
        {
          "type": "number"
        },
        {
          "type": "boolean"
        },
        {
          "type": "null"
        },
        {
          "type": "array",
          "items": {
            "$ref": "#/definitions/__schema0"
          }
        },
        {
          "type": "object",
          "propertyNames": {
            "type": "string"
          },
          "additionalProperties": {
            "$ref": "#/definitions/__schema0"
          }
        }
      ]
    },
    "__schema1": {
      "type": "object",
      "properties": {
        "name": {
          "type": "string"
        },
        "class": {
          "type": "string"
        },
        "properties": {
          "type": "object",
          "propertyNames": {
            "type": "string"
          },
          "additionalProperties": {
            "$ref": "#/definitions/__schema0"
          }
        },
        "events": {
          "type": "object",
          "propertyNames": {
            "type": "string"
          },
          "additionalProperties": {
            "type": "string"
          }
        },
        "controls": {
          "type": "array",
          "items": {
            "$ref": "#/definitions/__schema1"
          }
        }
      },
      "required": [
        "name",
        "class"
      ],
      "additionalProperties": false
    },
    "__schema2": {
      "type": "object",
      "properties": {
        "name": {
          "type": "string"
        },
        "properties": {
          "type": "object",
          "propertyNames": {
            "type": "string"
          },
          "additionalProperties": {
            "$ref": "#/definitions/__schema0"
          }
        },
        "events": {
          "type": "object",
          "propertyNames": {
            "type": "string"
          },
          "additionalProperties": {
            "type": "string"
          }
        },
        "items": {
          "type": "array",
          "items": {
            "$ref": "#/definitions/__schema2"
          }
        }
      },
      "required": [
        "name"
      ],
      "additionalProperties": false
    }
  }
}
