{
  "formatVersion": 1,
  "codegen": {
    "cpp": {},
    "python": {}
  },
  "form": {
    "name": "MainForm",
    "class": "TForm",
    "properties": {
      "Width": 400,
      "Height": 300,
      "Caption": "Sample",
      "Menu": "MainMenu1"
    },
    "events": { "OnCreate": "FormCreate", "OnCloseQuery": "FormCloseQuery" },
    "controls": [
      {
        "name": "NameEdit",
        "class": "TEdit",
        "properties": {
          "Left": 16,
          "Top": 16,
          "Width": 280,
          "Height": 23,
          "Hint": "Your name",
          "ShowHint": true,
          "Anchors": ["akTop", "akLeft", "akRight"]
        },
        "events": { "OnChange": "NameEditChange" }
      },
      {
        "name": "OkButton",
        "class": "TButton",
        "properties": {
          "Left": 304,
          "Top": 15,
          "Width": 75,
          "Height": 25,
          "Caption": "&OK",
          "Font": { "Style": ["fsBold"] },
          "Anchors": ["akTop", "akRight"]
        },
        "events": { "OnClick": "OkButtonClick" }
      },
      {
        "name": "PageControl1",
        "class": "TPageControl",
        "properties": {
          "Left": 16,
          "Top": 48,
          "Width": 363,
          "Height": 120,
          "ActivePage": "MemoSheet",
          "Anchors": ["akTop", "akLeft", "akRight"]
        },
        "controls": [
          {
            "name": "OptionSheet",
            "class": "TTabSheet",
            "properties": { "Caption": "Options" },
            "controls": [
              {
                "name": "WrapCheck",
                "class": "TCheckBox",
                "properties": {
                  "Left": 8,
                  "Top": 8,
                  "Width": 80,
                  "Height": 19,
                  "Caption": "Word wrap",
                  "Checked": true
                },
                "events": { "OnClick": "WrapCheckClick" }
              },
              {
                "name": "SizeSpin",
                "class": "TSpinEdit",
                "properties": {
                  "Left": 8,
                  "Top": 36,
                  "Width": 80,
                  "Height": 23,
                  "MaxValue": 200,
                  "Value": 150
                }
              }
            ]
          },
          {
            "name": "MemoSheet",
            "class": "TTabSheet",
            "properties": { "Caption": "Memo" },
            "controls": [
              {
                "name": "Memo1",
                "class": "TMemo",
                "properties": {
                  "Left": 0,
                  "Top": 0,
                  "Width": 355,
                  "Height": 92,
                  "Align": "alClient",
                  "Lines": ["line 1", "line \"2\""],
                  "ScrollBars": 3,
                  "PopupMenu": "PopupMenu1"
                }
              }
            ]
          }
        ]
      },
      {
        "name": "BottomPanel",
        "class": "TPanel",
        "properties": {
          "Left": 0,
          "Top": 259,
          "Width": 400,
          "Height": 41,
          "Caption": "",
          "Align": "alBottom",
          "Color": "#FFF0C0"
        },
        "controls": [
          {
            "name": "StatusLabel",
            "class": "TLabel",
            "properties": {
              "Left": 8,
              "Top": 12,
              "Width": 36,
              "Height": 17,
              "Caption": "Ready",
              "Font": { "Color": "clBlue", "Size": 10 }
            }
          }
        ]
      }
    ]
  },
  "components": [
    {
      "name": "MainMenu1",
      "class": "TMainMenu",
      "design": { "left": 16, "top": 200 },
      "items": [
        {
          "name": "FileMenu",
          "properties": { "Caption": "&File" },
          "items": [
            {
              "name": "FileOpenItem",
              "properties": { "Caption": "&Open...", "ShortCut": "Ctrl+O" },
              "events": { "OnClick": "FileOpenItemClick" }
            },
            { "name": "N1", "properties": { "Caption": "-" } },
            {
              "name": "FileExitItem",
              "properties": { "Caption": "E&xit" },
              "events": { "OnClick": "FileExitItemClick" }
            }
          ]
        }
      ]
    },
    {
      "name": "PopupMenu1",
      "class": "TPopupMenu",
      "design": { "left": 56, "top": 200 },
      "items": [
        {
          "name": "ClearItem",
          "properties": { "Caption": "Clear" },
          "events": { "OnClick": "ClearItemClick" }
        }
      ]
    },
    {
      "name": "OpenDialog1",
      "class": "TOpenDialog",
      "design": { "left": 96, "top": 200 },
      "properties": {
        "Filter": "Text files|*.txt|All files|*.*",
        "Options": ["ofEnableSizing", "ofViewDetail", "ofFileMustExist"]
      }
    },
    {
      "name": "Timer1",
      "class": "TTimer",
      "design": { "left": 136, "top": 200 },
      "properties": { "Enabled": false, "Interval": 500 },
      "events": { "OnTimer": "Timer1Timer" }
    }
  ]
}
